{
  "schema_version": "0.1.0",
  "ai_artifact_id": "ai-artifact-timeline-001",
  "artifact_type": "timeline",
  "source_module": "redshieldworks-docs",
  "intake_id": "secure-intake-manual-upload-001",
  "status": "proposed",
  "sensitivity": "restricted",
  "operation": {
    "operation_id": "ai-operation-timeline-001",
    "capability": "build_timeline",
    "actor_id": "actor-agent-001",
    "model_identity": "configured-agent-model",
    "tool_identity": "redshieldworks-secure-intake",
    "prompt_template_id": "secure-intake-timeline-v0_1_0"
  },
  "source_evidence_refs": [
    {
      "schema_version": "0.1.0",
      "evidence_id": "evidence-intake-source-001",
      "evidence_type": "source_file",
      "source": {
        "location_type": "private_path",
        "locator": "private/intake/synthetic/source-001.pdf",
        "display_name": "Synthetic source PDF"
      },
      "sensitivity": "restricted",
      "created_at": "2026-07-05T11:30:00Z"
    }
  ],
  "content_summary": "Synthetic timeline proposal derived from one approved private source reference.",
  "confidence": {
    "level": "medium",
    "score": 0.74,
    "notes": "Synthetic confidence value for fixture validation."
  },
  "review": {
    "required": true,
    "status": "pending"
  },
  "action_boundary": {
    "downstream_action": "internal_work_item",
    "approval_gate": "privacy_sensitive_action"
  },
  "policy": {
    "policy_check_ids": [
      "policy-check-ai-intake-001"
    ],
    "knightwarden_review": {
      "provider": "rsk-security-knightwarden",
      "status": "not_configured",
      "risk_level": "unknown"
    }
  },
  "audit_event_ids": [],
  "created_at": "2026-07-05T11:35:00Z"
}
